{
  "schema_version": "v1",
  "generated_at": "2026-01-30T08:57:07.415Z",
  "errors": [
    {
      "code": "PATTERN_ID_INVALID",
      "message": "pattern_id is missing or invalid (goal)",
      "question_id": "H17-1-I-1",
      "file": "content/questions/H17-1/course2/H17-1-I-1.json"
    },
    {
      "code": "PATTERN_ID_INVALID",
      "message": "pattern_id is missing or invalid (missing)",
      "question_id": "H17-1-I-2",
      "file": "content/questions/H17-1/course2/H17-1-I-2.json"
    },
    {
      "code": "PATTERN_ID_INVALID",
      "message": "pattern_id is missing or invalid (missing)",
      "question_id": "H17-1-II-1",
      "file": "content/questions/H17-1/course2/H17-1-II-1.json"
    },
    {
      "code": "PATTERN_ID_INVALID",
      "message": "pattern_id is missing or invalid (missing)",
      "question_id": "H17-1-II-2",
      "file": "content/questions/H17-1/course2/H17-1-II-2.json"
    },
    {
      "code": "PATTERN_ID_INVALID",
      "message": "pattern_id is missing or invalid (missing)",
      "question_id": "H17-1-III-1",
      "file": "content/questions/H17-1/course2/H17-1-III-1.json"
    },
    {
      "code": "PATTERN_ID_INVALID",
      "message": "pattern_id is missing or invalid (missing)",
      "question_id": "H17-1-III-2",
      "file": "content/questions/H17-1/course2/H17-1-III-2.json"
    },
    {
      "code": "PATTERN_ID_INVALID",
      "message": "pattern_id is missing or invalid (missing)",
      "question_id": "H17-1-IV-1",
      "file": "content/questions/H17-1/course2/H17-1-IV-1.json"
    },
    {
      "code": "PATTERN_ID_INVALID",
      "message": "pattern_id is missing or invalid (missing)",
      "question_id": "H17-1-IV-2",
      "file": "content/questions/H17-1/course2/H17-1-IV-2.json"
    },
    {
      "code": "TAGS_MISSING",
      "message": "tags are missing or empty",
      "question_id": "H17-2-I-1",
      "file": "content/questions/H17-2/course2/H17-2-I-1.json"
    },
    {
      "code": "PATTERN_ID_INVALID",
      "message": "pattern_id is missing or invalid (missing)",
      "question_id": "H17-2-I-1",
      "file": "content/questions/H17-2/course2/H17-2-I-1.json"
    },
    {
      "code": "TAGS_MISSING",
      "message": "tags are missing or empty",
      "question_id": "H17-2-I-2",
      "file": "content/questions/H17-2/course2/H17-2-I-2.json"
    },
    {
      "code": "PATTERN_ID_INVALID",
      "message": "pattern_id is missing or invalid (missing)",
      "question_id": "H17-2-I-2",
      "file": "content/questions/H17-2/course2/H17-2-I-2.json"
    },
    {
      "code": "TAGS_MISSING",
      "message": "tags are missing or empty",
      "question_id": "H17-2-II-1",
      "file": "content/questions/H17-2/course2/H17-2-II-1.json"
    },
    {
      "code": "PATTERN_ID_INVALID",
      "message": "pattern_id is missing or invalid (goal)",
      "question_id": "H17-2-II-1",
      "file": "content/questions/H17-2/course2/H17-2-II-1.json"
    },
    {
      "code": "TAGS_MISSING",
      "message": "tags are missing or empty",
      "question_id": "H17-2-II-2",
      "file": "content/questions/H17-2/course2/H17-2-II-2.json"
    },
    {
      "code": "TAGS_MISSING",
      "message": "tags are missing or empty",
      "question_id": "H17-2-III-1",
      "file": "content/questions/H17-2/course2/H17-2-III-1.json"
    },
    {
      "code": "TAGS_MISSING",
      "message": "tags are missing or empty",
      "question_id": "H17-2-III-2",
      "file": "content/questions/H17-2/course2/H17-2-III-2.json"
    },
    {
      "code": "PATTERN_ID_INVALID",
      "message": "pattern_id is missing or invalid (mechanism)",
      "question_id": "H17-2-III-2",
      "file": "content/questions/H17-2/course2/H17-2-III-2.json"
    },
    {
      "code": "TAGS_MISSING",
      "message": "tags are missing or empty",
      "question_id": "H17-2-IV-1",
      "file": "content/questions/H17-2/course2/H17-2-IV-1.json"
    },
    {
      "code": "TAGS_MISSING",
      "message": "tags are missing or empty",
      "question_id": "H17-2-IV-2",
      "file": "content/questions/H17-2/course2/H17-2-IV-2.json"
    },
    {
      "code": "TAGS_MISSING",
      "message": "tags are missing or empty",
      "question_id": "H18-1-I-1",
      "file": "content/questions/H18-1/course2/H18-1-I-1.json"
    },
    {
      "code": "TAGS_MISSING",
      "message": "tags are missing or empty",
      "question_id": "H18-1-I-2",
      "file": "content/questions/H18-1/course2/H18-1-I-2.json"
    },
    {
      "code": "TAGS_MISSING",
      "message": "tags are missing or empty",
      "question_id": "H18-1-II-1",
      "file": "content/questions/H18-1/course2/H18-1-II-1.json"
    },
    {
      "code": "PATTERN_ID_INVALID",
      "message": "pattern_id is missing or invalid (domain)",
      "question_id": "H18-1-II-1",
      "file": "content/questions/H18-1/course2/H18-1-II-1.json"
    },
    {
      "code": "TAGS_MISSING",
      "message": "tags are missing or empty",
      "question_id": "H18-1-II-2",
      "file": "content/questions/H18-1/course2/H18-1-II-2.json"
    },
    {
      "code": "PATTERN_ID_INVALID",
      "message": "pattern_id is missing or invalid (mechanism)",
      "question_id": "H18-1-II-2",
      "file": "content/questions/H18-1/course2/H18-1-II-2.json"
    },
    {
      "code": "TAGS_MISSING",
      "message": "tags are missing or empty",
      "question_id": "H18-1-III-1",
      "file": "content/questions/H18-1/course2/H18-1-III-1.json"
    },
    {
      "code": "PATTERN_ID_INVALID",
      "message": "pattern_id is missing or invalid (mechanism)",
      "question_id": "H18-1-III-1",
      "file": "content/questions/H18-1/course2/H18-1-III-1.json"
    },
    {
      "code": "TAGS_MISSING",
      "message": "tags are missing or empty",
      "question_id": "H18-1-III-2",
      "file": "content/questions/H18-1/course2/H18-1-III-2.json"
    },
    {
      "code": "PATTERN_ID_INVALID",
      "message": "pattern_id is missing or invalid (domain)",
      "question_id": "H18-1-III-2",
      "file": "content/questions/H18-1/course2/H18-1-III-2.json"
    },
    {
      "code": "TAGS_MISSING",
      "message": "tags are missing or empty",
      "question_id": "H18-1-IV-1",
      "file": "content/questions/H18-1/course2/H18-1-IV-1.json"
    },
    {
      "code": "PATTERN_ID_INVALID",
      "message": "pattern_id is missing or invalid (mechanism)",
      "question_id": "H18-1-IV-1",
      "file": "content/questions/H18-1/course2/H18-1-IV-1.json"
    },
    {
      "code": "TAGS_MISSING",
      "message": "tags are missing or empty",
      "question_id": "H18-1-IV-2",
      "file": "content/questions/H18-1/course2/H18-1-IV-2.json"
    },
    {
      "code": "PATTERN_ID_INVALID",
      "message": "pattern_id is missing or invalid (domain)",
      "question_id": "H18-1-IV-2",
      "file": "content/questions/H18-1/course2/H18-1-IV-2.json"
    },
    {
      "code": "PATTERN_ID_INVALID",
      "message": "pattern_id is missing or invalid (goal)",
      "question_id": "H18-2-I-1",
      "file": "content/questions/H18-2/course2/H18-2-I-1.json"
    },
    {
      "code": "PATTERN_ID_INVALID",
      "message": "pattern_id is missing or invalid (goal)",
      "question_id": "H18-2-II-2",
      "file": "content/questions/H18-2/course2/H18-2-II-2.json"
    },
    {
      "code": "PATTERN_ID_INVALID",
      "message": "pattern_id is missing or invalid (mechanism)",
      "question_id": "H18-2-III-1",
      "file": "content/questions/H18-2/course2/H18-2-III-1.json"
    },
    {
      "code": "PATTERN_ID_INVALID",
      "message": "pattern_id is missing or invalid (domain)",
      "question_id": "H19-1-I-1",
      "file": "content/questions/H19-1/course2/H19-1-I-1.json"
    },
    {
      "code": "PATTERN_ID_INVALID",
      "message": "pattern_id is missing or invalid (format)",
      "question_id": "H19-1-I-2",
      "file": "content/questions/H19-1/course2/H19-1-I-2.json"
    },
    {
      "code": "PATTERN_ID_INVALID",
      "message": "pattern_id is missing or invalid (domain)",
      "question_id": "H19-1-II-1",
      "file": "content/questions/H19-1/course2/H19-1-II-1.json"
    },
    {
      "code": "PATTERN_ID_INVALID",
      "message": "pattern_id is missing or invalid (domain)",
      "question_id": "H19-1-II-2",
      "file": "content/questions/H19-1/course2/H19-1-II-2.json"
    },
    {
      "code": "PATTERN_ID_INVALID",
      "message": "pattern_id is missing or invalid (domain)",
      "question_id": "H19-1-III-1",
      "file": "content/questions/H19-1/course2/H19-1-III-1.json"
    },
    {
      "code": "PATTERN_ID_INVALID",
      "message": "pattern_id is missing or invalid (domain)",
      "question_id": "H19-1-III-2",
      "file": "content/questions/H19-1/course2/H19-1-III-2.json"
    },
    {
      "code": "PATTERN_ID_INVALID",
      "message": "pattern_id is missing or invalid (domain)",
      "question_id": "H19-1-IV-1",
      "file": "content/questions/H19-1/course2/H19-1-IV-1.json"
    },
    {
      "code": "PATTERN_ID_INVALID",
      "message": "pattern_id is missing or invalid (domain)",
      "question_id": "H19-1-IV-2",
      "file": "content/questions/H19-1/course2/H19-1-IV-2.json"
    },
    {
      "code": "PATTERN_ID_INVALID",
      "message": "pattern_id is missing or invalid (domain)",
      "question_id": "H19-2-I-1",
      "file": "content/questions/H19-2/course2/H19-2-I-1.json"
    },
    {
      "code": "PATTERN_ID_INVALID",
      "message": "pattern_id is missing or invalid (domain)",
      "question_id": "H19-2-I-2",
      "file": "content/questions/H19-2/course2/H19-2-I-2.json"
    },
    {
      "code": "TAGS_MISSING",
      "message": "tags are missing or empty",
      "question_id": "H19-2-II-1",
      "file": "content/questions/H19-2/course2/H19-2-II-1.json"
    },
    {
      "code": "TAGS_MISSING",
      "message": "tags are missing or empty",
      "question_id": "H19-2-II-2",
      "file": "content/questions/H19-2/course2/H19-2-II-2.json"
    },